{
 "schemaVersion": "0.1.0",
 "generatedAt": "2026-10-03T11:00:00+05:30",
 "synthetic": true,
 "notice": "SYNTHETIC test data for setup-wizard.md. No real people, accounts or amounts.",
 "currency": "INR",
 "accounts": [
  {
   "id": "acc_sav001",
   "name": "Everyday Savings",
   "type": "savings",
   "institution": "HDFC Bank",
   "mask": "0001",
   "currency": "INR",
   "balance": 21000000,
   "asOf": "2026-10-02",
   "source": "statement"
  },
  {
   "id": "acc_crd001",
   "name": "Rewards Card",
   "type": "credit_card",
   "institution": "HDFC Bank",
   "mask": "0002",
   "currency": "INR",
   "balance": -835000,
   "creditLimit": 10000000,
   "statementDay": 20,
   "dueDay": 8,
   "asOf": "2026-08-20",
   "source": "statement"
  },
  {
   "id": "acc_mfd001",
   "name": "Sample Flexi Cap Fund - Direct Growth",
   "type": "mutual_fund",
   "institution": "Sample AMC",
   "mask": "0003",
   "currency": "INR",
   "balance": 6421000,
   "invested": 6000000,
   "asOf": "2026-09-30",
   "source": "cas"
  }
 ],
 "transactions": [
  {
   "id": "txn_sw0001",
   "accountId": "acc_sav001",
   "date": "2026-07-01",
   "amount": 8500000,
   "description": "Acme Payroll",
   "merchant": "Acme Payroll",
   "category": "income",
   "method": "upi",
   "categorisedBy": "rule"
  },
  {
   "id": "txn_sw0002",
   "accountId": "acc_sav001",
   "date": "2026-07-01",
   "amount": -1800000,
   "description": "Landlord Rent",
   "merchant": "Landlord Rent",
   "category": "rent",
   "method": "upi",
   "categorisedBy": "rule"
  },
  {
   "id": "txn_sw0003",
   "accountId": "acc_crd001",
   "date": "2026-07-02",
   "amount": -64900,
   "description": "StreamFlix",
   "merchant": "StreamFlix",
   "category": "subscriptions",
   "method": "card",
   "categorisedBy": "rule"
  },
  {
   "id": "txn_sw0004",
   "accountId": "acc_sav001",
   "date": "2026-07-03",
   "amount": -500000,
   "description": "Index Fund SIP",
   "merchant": "Index Fund SIP",
   "category": "investments",
   "method": "upi",
   "categorisedBy": "rule"
  },
  {
   "id": "txn_sw0005",
   "accountId": "acc_crd001",
   "date": "2026-07-04",
   "amount": -49900,
   "description": "TuneBox",
   "merchant": "TuneBox",
   "category": "subscriptions",
   "method": "card",
   "categorisedBy": "rule"
  },
  {
   "id": "txn_sw0006",
   "accountId": "acc_sav001",
   "date": "2026-07-05",
   "amount": -350000,
   "description": "Phone EMI",
   "merchant": "Phone EMI",
   "category": "emi",
   "method": "upi",
   "categorisedBy": "rule"
  },
  {
   "id": "txn_sw0007",
   "accountId": "acc_sav001",
   "date": "2026-07-06",
   "amount": -240000,
   "description": "City Power",
   "merchant": "City Power",
   "category": "utilities",
   "method": "upi",
   "categorisedBy": "rule"
  },
  {
   "id": "txn_sw0008",
   "accountId": "acc_sav001",
   "date": "2026-07-08",
   "amount": -430000,
   "description": "Kirana Corner",
   "merchant": "Kirana Corner",
   "category": "groceries",
   "method": "upi",
   "categorisedBy": "rule"
  },
  {
   "id": "txn_sw0009",
   "accountId": "acc_crd001",
   "date": "2026-07-09",
   "amount": -340000,
   "description": "QuickBite Delivery",
   "merchant": "QuickBite Delivery",
   "category": "dining",
   "method": "card",
   "categorisedBy": "rule"
  },
  {
   "id": "txn_sw0010",
   "accountId": "acc_sav001",
   "date": "2026-07-11",
   "amount": -210000,
   "description": "Metro Card",
   "merchant": "Metro Card",
   "category": "transport",
   "method": "upi",
   "categorisedBy": "rule"
  },
  {
   "id": "txn_sw0011",
   "accountId": "acc_crd001",
   "date": "2026-07-14",
   "amount": -750000,
   "description": "ZipCart",
   "merchant": "ZipCart",
   "category": "shopping",
   "method": "card",
   "categorisedBy": "rule"
  },
  {
   "id": "txn_sw0012",
   "accountId": "acc_sav001",
   "date": "2026-07-15",
   "amount": -1248000,
   "description": "SafeLife Insurance",
   "merchant": "SafeLife Insurance",
   "category": "insurance",
   "method": "upi",
   "categorisedBy": "rule"
  },
  {
   "id": "txn_sw0013",
   "accountId": "acc_crd001",
   "date": "2026-07-18",
   "amount": -90000,
   "description": "CineMax",
   "merchant": "CineMax",
   "category": "entertainment",
   "method": "card",
   "categorisedBy": "rule"
  },
  {
   "id": "txn_sw0014",
   "accountId": "acc_crd001",
   "date": "2026-07-20",
   "amount": -550000,
   "description": "FreshMart",
   "merchant": "FreshMart",
   "category": "groceries",
   "method": "card",
   "categorisedBy": "rule"
  },
  {
   "id": "txn_sw0015",
   "accountId": "acc_crd001",
   "date": "2026-07-22",
   "amount": -280000,
   "description": "Spice Route",
   "merchant": "Spice Route",
   "category": "dining",
   "method": "card",
   "categorisedBy": "rule"
  },
  {
   "id": "txn_sw0016",
   "accountId": "acc_sav001",
   "date": "2026-07-25",
   "amount": -70000,
   "description": "Misc Store",
   "merchant": "Misc Store",
   "category": "other",
   "method": "upi",
   "categorisedBy": "rule"
  },
  {
   "id": "txn_sw0017",
   "accountId": "acc_sav001",
   "date": "2026-07-28",
   "amount": -1000000,
   "description": "Self transfer",
   "merchant": "Self transfer",
   "category": "transfers",
   "method": "upi",
   "categorisedBy": "rule"
  },
  {
   "id": "txn_sw0018",
   "accountId": "acc_sav001",
   "date": "2026-08-01",
   "amount": 8500000,
   "description": "Acme Payroll",
   "merchant": "Acme Payroll",
   "category": "income",
   "method": "upi",
   "categorisedBy": "rule"
  },
  {
   "id": "txn_sw0019",
   "accountId": "acc_sav001",
   "date": "2026-08-01",
   "amount": -1800000,
   "description": "Landlord Rent",
   "merchant": "Landlord Rent",
   "category": "rent",
   "method": "upi",
   "categorisedBy": "rule"
  },
  {
   "id": "txn_sw0020",
   "accountId": "acc_crd001",
   "date": "2026-08-02",
   "amount": -64900,
   "description": "StreamFlix",
   "merchant": "StreamFlix",
   "category": "subscriptions",
   "method": "card",
   "categorisedBy": "rule"
  },
  {
   "id": "txn_sw0021",
   "accountId": "acc_sav001",
   "date": "2026-08-03",
   "amount": -500000,
   "description": "Index Fund SIP",
   "merchant": "Index Fund SIP",
   "category": "investments",
   "method": "upi",
   "categorisedBy": "rule"
  },
  {
   "id": "txn_sw0022",
   "accountId": "acc_crd001",
   "date": "2026-08-04",
   "amount": -49900,
   "description": "TuneBox",
   "merchant": "TuneBox",
   "category": "subscriptions",
   "method": "card",
   "categorisedBy": "rule"
  },
  {
   "id": "txn_sw0023",
   "accountId": "acc_sav001",
   "date": "2026-08-05",
   "amount": -350000,
   "description": "Phone EMI",
   "merchant": "Phone EMI",
   "category": "emi",
   "method": "upi",
   "categorisedBy": "rule"
  },
  {
   "id": "txn_sw0024",
   "accountId": "acc_sav001",
   "date": "2026-08-06",
   "amount": -240000,
   "description": "City Power",
   "merchant": "City Power",
   "category": "utilities",
   "method": "upi",
   "categorisedBy": "rule"
  },
  {
   "id": "txn_sw0025",
   "accountId": "acc_sav001",
   "date": "2026-08-07",
   "amount": -520000,
   "description": "Kirana Corner",
   "merchant": "Kirana Corner",
   "category": "groceries",
   "method": "upi",
   "categorisedBy": "rule"
  },
  {
   "id": "txn_sw0026",
   "accountId": "acc_crd001",
   "date": "2026-08-10",
   "amount": -290000,
   "description": "QuickBite Delivery",
   "merchant": "QuickBite Delivery",
   "category": "dining",
   "method": "card",
   "categorisedBy": "rule"
  },
  {
   "id": "txn_sw0027",
   "accountId": "acc_sav001",
   "date": "2026-08-12",
   "amount": -265000,
   "description": "Metro Card",
   "merchant": "Metro Card",
   "category": "transport",
   "method": "upi",
   "categorisedBy": "rule"
  },
  {
   "id": "txn_sw0028",
   "accountId": "acc_sav001",
   "date": "2026-08-14",
   "amount": -200000,
   "description": "Gift Shop",
   "merchant": "Gift Shop",
   "category": "gifts",
   "method": "upi",
   "categorisedBy": "rule"
  },
  {
   "id": "txn_sw0029",
   "accountId": "acc_crd001",
   "date": "2026-08-16",
   "amount": -320000,
   "description": "ZipCart",
   "merchant": "ZipCart",
   "category": "shopping",
   "method": "card",
   "categorisedBy": "rule"
  },
  {
   "id": "txn_sw0030",
   "accountId": "acc_crd001",
   "date": "2026-08-17",
   "amount": -145000,
   "description": "CineMax",
   "merchant": "CineMax",
   "category": "entertainment",
   "method": "card",
   "categorisedBy": "rule"
  },
  {
   "id": "txn_sw0031",
   "accountId": "acc_crd001",
   "date": "2026-08-19",
   "amount": 120000,
   "description": "ZipCart",
   "merchant": "ZipCart",
   "category": "shopping",
   "method": "card",
   "categorisedBy": "rule",
   "tags": [
    "refund"
   ]
  },
  {
   "id": "txn_sw0032",
   "accountId": "acc_crd001",
   "date": "2026-08-21",
   "amount": -600000,
   "description": "FreshMart",
   "merchant": "FreshMart",
   "category": "groceries",
   "method": "card",
   "categorisedBy": "rule"
  },
  {
   "id": "txn_sw0033",
   "accountId": "acc_crd001",
   "date": "2026-08-23",
   "amount": -200000,
   "description": "Spice Route",
   "merchant": "Spice Route",
   "category": "dining",
   "method": "card",
   "categorisedBy": "rule"
  },
  {
   "id": "txn_sw0034",
   "accountId": "acc_sav001",
   "date": "2026-08-26",
   "amount": -60000,
   "description": "Misc Store",
   "merchant": "Misc Store",
   "category": "other",
   "method": "upi",
   "categorisedBy": "rule"
  },
  {
   "id": "txn_sw0035",
   "accountId": "acc_sav001",
   "date": "2026-09-01",
   "amount": 8500000,
   "description": "Acme Payroll",
   "merchant": "Acme Payroll",
   "category": "income",
   "method": "upi",
   "categorisedBy": "rule"
  },
  {
   "id": "txn_sw0036",
   "accountId": "acc_sav001",
   "date": "2026-09-01",
   "amount": -1800000,
   "description": "Landlord Rent",
   "merchant": "Landlord Rent",
   "category": "rent",
   "method": "upi",
   "categorisedBy": "rule"
  },
  {
   "id": "txn_sw0037",
   "accountId": "acc_sav001",